user	instance_id	displayed_text	patient_competence:::slightly low	patient_competence:::slightly high	patient_agency:::slightly low	patient_communicator:::slightly low	patient_communicator:::medium	patient_communicator:::slightly high	patient_respect:::slightly low	patient_respect:::medium	patient_empathy:::slightly low	patient_empathy:::medium	patient_warmth:::slightly high	patient_warmth:::medium	patient_info:::slightly low	patient_support:::slightly high	patient_support:::medium	patient_partner:::slightly low	patient_partner:::slightly high	patient_partner:::medium	What race do you think the patient is? :::Unsure	observer_competence:::slightly low	observer_competence:::medium	observer_agency:::medium	observer_communicator:::slightly low
yinuoxu54@berkeley.edu	conv1084_3-snip0	"<span class=""redText"">DOCTOR</span>: <span class=""redText"">Can you guys stop moving?</span><br><br><span class=""greenText"">FAMILY MEMBER</span>: <span class=""greenText"">We’re done.</span><br><br><span class=""redText"">DOCTOR</span>: <span class=""redText"">Oh yes, I’m just checking. And how is it? Do you love it?</span><br><br><span class=""greenText"">FAMILY MEMBER</span>: <span class=""greenText"">Yeah, it’s uh; we have to make some changes but yeah, it feels like home.</span><br><br><span class=""redText"">DOCTOR</span>: <span class=""redText"">That’s awesome, no ladders for you, right?</span><br><br><span class=""greenText"">FAMILY MEMBER</span>: <span class=""greenText"">I had to argue with him about it.</span><br><br><span class=""blueText"">PATIENT</span>: <span class=""blueText"">Could I give away all my ladders?</span><br><br><span class=""redText"">DOCTOR</span>: <span class=""redText"">Did you put it in the garage sale?</span><br><br><span class=""redText"">DOCTOR</span>: <span class=""redText"">I was going to do a drive-by and take your ladder.</span><br><br><span class=""redText"">DOCTOR</span>: <span class=""redText"">laughs & PAT chuckles</span>"	2		2	2				3		3	4		2	4				3					
yinuoxu54@berkeley.edu	Doctor-Patient-Conversation-Analysis-post_annotation_question.html	Post annotation question																			What race do you think the patient is? :::Unsure				
yinuoxu54@berkeley.edu	conv1084_3-snip4	"<span class=""redText"">DOCTOR</span>: <span class=""redText"">Yeah, I mean it’s not a humongous spot. But it still is enough for it’s -</span><br><br><span class=""greenText"">FAMILY MEMBER</span>: <span class=""greenText"">Causing pain.</span><br><br><span class=""redText"">DOCTOR</span>: <span class=""redText"">Uh hum.</span><br><br><span class=""greenText"">FAMILY MEMBER</span>: <span class=""greenText"">I thought maybe he might have hurt his self when he was carrying boxes up and down stairs</span><br><br><span class=""redText"">DOCTOR</span>: <span class=""redText"">No, now we’re down now, though, right? No more.</span><br><br><span class=""blueText"">PATIENT</span>: <span class=""blueText"">Well, I don’t think it was so much carrying boxes because my kids and my wife wouldn’t let me carry weight.</span><br><br><span class=""redText"">DOCTOR</span>: <span class=""redText"">Yeah.</span><br><br><span class=""greenText"">FAMILY MEMBER</span>: <span class=""greenText"">But you did.</span><br><br><span class=""blueText"">PATIENT</span>: <span class=""blueText"">But it was, no but it was never a heavy weight. It was just, yeah, I did do a lot of up and down the stairs.</span><br><br><span class=""redText"">DOCTOR</span>: <span class=""redText"">Yeah.</span>"														4			4						
yinuoxu54@berkeley.edu	conv1084_3-snip6	"<span class=""redText"">DOCTOR</span>: <span class=""redText"">So it isn’t like he stands there and they only shoot it up like a bone injection.</span><br><br><span class=""greenText"">FAMILY MEMBER</span>: <span class=""greenText"">Oh.</span><br><br><span class=""redText"">DOCTOR</span>: <span class=""redText"">Uhn-uhn. You get an intravenous you know little catheter.</span><br><br><span class=""blueText"">PATIENT</span>: <span class=""blueText"">And that’s going to be in me for six months.</span><br><br><span class=""redText"">DOCTOR</span>: <span class=""redText"">Yeah, like they give it to you - it’s like one minute, and you’re done for the month.</span><br><br><span class=""greenText"">FAMILY MEMBER</span>: <span class=""greenText"">Does he have to keep that catheter in there for the whole month?</span><br><br><span class=""redText"">DOCTOR</span>: <span class=""redText"">No.</span><br><br><span class=""greenText"">FAMILY MEMBER</span>: <span class=""greenText"">Oh good.</span><br><br><span class=""redText"">DOCTOR</span>: <span class=""redText"">Like you put it in</span><br><br><span class=""redText"">DOCTOR</span>: <span class=""redText"">makes mimicking sound</span>"																				2			
yinuoxu54@berkeley.edu	conv1084_3-snip1	"<span class=""blueText"">PATIENT</span>: <span class=""blueText"">So what makes you think I may have fallen again?</span><br><br><span class=""redText"">DOCTOR</span>: <span class=""redText"">Because I can’t, K just mentioned that she thought you did.</span><br><br><span class=""blueText"">PATIENT</span>: <span class=""blueText"">Oh.</span><br><br><span class=""redText"">DOCTOR</span>: <span class=""redText"">But it might have been last time.</span><br><br><span class=""greenText"">FAMILY MEMBER</span>: <span class=""greenText"">Yeah.</span><br><br><span class=""redText"">DOCTOR</span>: <span class=""redText"">Okay, and I was like just and then she was on the phone, I was like did she mean now or did she mean before?</span><br><br><span class=""greenText"">FAMILY MEMBER</span>: <span class=""greenText"">No, because he was in pain; he was in pain.</span><br><br><span class=""redText"">DOCTOR</span>: <span class=""redText"">Where is your worst pain do you think?</span><br><br><span class=""blueText"">PATIENT</span>: <span class=""blueText"">Right here.</span><br><br><span class=""redText"">DOCTOR</span>: <span class=""redText"">Still. Well, you’ve got some new spots on the bone scan. That’s one of them and upper spine is the other, you know kind of like of like by the neck area. So I don’t think this Xtandi is holding you as much as we’d like.</span>"		4	2			4		3	2			3	2		3	2					3	3	2
hi@gmail.com	conv1003_2-snip3	"<span class=""blueText"">PATIENT</span>: <span class=""blueText"">Okay.</span><br><br><span class=""redText"">DOCTOR</span>: <span class=""redText"">Okay?  And, chances we are going to have to put you on a medication called Zytiga.</span><br><br><span class=""blueText"">PATIENT</span>: <span class=""blueText"">Okay.</span><br><br><span class=""redText"">DOCTOR</span>: <span class=""redText"">Okay. This is a pill. These are pills that have a very good chance of working against the cancer.</span><br><br><span class=""blueText"">PATIENT</span>: <span class=""blueText"">Okay.</span><br><br><span class=""redText"">DOCTOR</span>: <span class=""redText"">And they will likely shrink the disease and, you know, also lower the PSA, and the good thing is they are likely to work for long periods of time.</span><br><br><span class=""blueText"">PATIENT</span>: <span class=""blueText"">Okay.</span><br><br><span class=""redText"">DOCTOR</span>: <span class=""redText"">But, the possibility of side effects is a little bit higher. Okay?  And usually, those side effects are high blood pressure, leg swelling, low potassium. So, you’re going to have to monitor and stay with the visits because at least for the first few months, we’ll have to monitor you somewhat closer.</span><br><br><span class=""blueText"">PATIENT</span>: <span class=""blueText"">Okay.</span><br><br><span class=""redText"">DOCTOR</span>: <span class=""redText"">Once both of us sort of get comfortable, like we did, but you got too comfortable,</span>"			2		3		2		2		4		2	4				3					
